{
  "schema_version": "graphgraph.eval.v1",
  "versions": {
    "task_resolver": "node-qrel-v3-facets",
    "reference_tokenizers": "cl100k_base+o200k_base@tiktoken-0.13.0",
    "token_proxy": "piece-punctuation-ls-v1",
    "expected_evidence": "independent-source-receipt-v1"
  },
  "project": {
    "id": "graphgraph",
    "repository": "takku1/graphgraph",
    "commit": "1ea88b909fc8f12dbca69ad3f02fcc8c0b820e6f",
    "language": "python",
    "split": "train"
  },
  "oracle": {
    "method": "committed_source_control_for_split_completeness_only",
    "refs": ["src/graphgraph/planning/routing.py:257"]
  },
  "tasks": [
    {
      "id": "GG-ROTATION-CONTROL-001",
      "query": "Where is route_query defined?",
      "query_class": "direct_lookup",
      "strata": ["exact", "train_control"],
      "expected": ["src/graphgraph/planning/routing.py"],
      "oracle_refs": ["src/graphgraph/planning/routing.py:257"]
    }
  ]
}
