{
  "schema_version": "graphgraph.eval.v1",
  "versions": {
    "task_resolver": "node-qrel-v3-facets",
    "reference_tokenizers": "cl100k_base+o200k_base@tiktoken-0.13.0",
    "token_proxy": "piece-punctuation-ls-v1",
    "expected_evidence": "independent-source-receipt-v1"
  },
  "project": {
    "id": "graphgraph",
    "repository": "takku1/graphgraph",
    "commit": "d7c4ab1fa3a73c55adf58360da73816a4e17ff07",
    "language": "python",
    "split": "train"
  },
  "oracle": {
    "method": "committed_source_control_for_split_completeness_only",
    "refs": ["src/graphgraph/services/freshness.py:25"]
  },
  "tasks": [
    {
      "id": "GG-CONCEPTUAL-CONTROL-001",
      "query": "Where is inspect_saved_graph_freshness defined?",
      "query_class": "direct_lookup",
      "strata": ["exact", "train_control"],
      "expected": ["src/graphgraph/services/freshness.py"],
      "oracle_refs": ["src/graphgraph/services/freshness.py:25 def inspect_saved_graph_freshness"]
    }
  ]
}
