{
  "schema_version": "graphgraph.eval.v1",
  "versions": {
    "task_resolver": "node-qrel-v3-facets",
    "reference_tokenizers": "cl100k_base+o200k_base@tiktoken-0.13.0",
    "token_proxy": "piece-punctuation-ls-v1",
    "expected_evidence": "independent-source-receipt-v1"
  },
  "project": {
    "id": "locus",
    "repository": "takku1/locus",
    "commit": "76d80f99b5bb3f88dd69fbb20b1960b85a85d054",
    "language": "rust",
    "split": "test"
  },
  "oracle": {
    "method": "manual_source_inspection_of_rust_item_definitions_and_doc_comments",
    "refs": [
      "crates/locus-core/src/evidence.rs:13",
      "crates/locus-core/src/advisor.rs:19",
      "crates/locus-core/src/advisor.rs:30",
      "crates/locus-core/src/cost.rs:7",
      "crates/locus-core/src/cost.rs:134",
      "crates/locus-engine/src/bilinear.rs:33",
      "crates/locus-engine/src/bilinear.rs:321",
      "crates/locus-engine/src/bayes.rs:94",
      "crates/locus-engine/src/bayes.rs:137",
      "crates/locus-pipeline/src/lib.rs:113"
    ]
  },
  "tasks": [
    {
      "id": "LOC-TEST-C01",
      "query": "How does the tool record how sure it is that a conclusion holds?",
      "query_class": "direct_lookup",
      "strata": ["conceptual", "lexical_disjoint"],
      "expected_facets": {
        "confidence_ladder": ["EvidenceStage"]
      },
      "oracle_refs": ["crates/locus-core/src/evidence.rs:13"]
    },
    {
      "id": "LOC-TEST-C02",
      "query": "What keeps a speed claim from being silently tied to one machine?",
      "query_class": "direct_lookup",
      "strata": ["conceptual", "lexical_disjoint"],
      "expected_facets": {
        "portability_qualifier": ["TargetScope"]
      },
      "oracle_refs": ["crates/locus-core/src/advisor.rs:19"]
    },
    {
      "id": "LOC-TEST-C03",
      "query": "Which contract lets a new lens of inspection be registered and applied uniformly?",
      "query_class": "direct_lookup",
      "strata": ["conceptual", "lexical_disjoint"],
      "expected_facets": {
        "pluggable_lens": ["Advisor"]
      },
      "oracle_refs": ["crates/locus-core/src/advisor.rs:30"]
    },
    {
      "id": "LOC-TEST-C04",
      "query": "Where are the relative expenses of arithmetic on a given chip described?",
      "query_class": "subsystem_summary",
      "strata": ["conceptual", "lexical_disjoint", "compound"],
      "expected_facets": {
        "machine_weights": ["HardwareProfile"],
        "operation_weights": ["OpCosts"]
      },
      "oracle_refs": [
        "crates/locus-core/src/cost.rs:7",
        "crates/locus-core/src/cost.rs:134"
      ]
    },
    {
      "id": "LOC-TEST-C05",
      "query": "Which routine assembles a way to multiply matrices using fewer scalar products than the obvious triple loop?",
      "query_class": "direct_lookup",
      "strata": ["conceptual", "lexical_disjoint"],
      "expected_facets": {
        "subcubic_construction": ["strassen_recursive"]
      },
      "oracle_refs": ["crates/locus-engine/src/bilinear.rs:321"]
    },
    {
      "id": "LOC-TEST-C06",
      "query": "What single structure wires the discovery stages together in order?",
      "query_class": "subsystem_summary",
      "strata": ["conceptual", "lexical_disjoint"],
      "expected_facets": {
        "pipeline_orchestrator": ["LocusEngine"]
      },
      "oracle_refs": ["crates/locus-pipeline/src/lib.rs:113"]
    },
    {
      "id": "LOC-TEST-C07",
      "query": "How are prior expectations revised as fresh observations arrive?",
      "query_class": "subsystem_summary",
      "strata": ["conceptual", "lexical_disjoint", "compound"],
      "expected_facets": {
        "continuous_update": ["NormalBelief"],
        "categorical_update": ["Dirichlet"]
      },
      "oracle_refs": [
        "crates/locus-engine/src/bayes.rs:94",
        "crates/locus-engine/src/bayes.rs:137"
      ]
    },
    {
      "id": "LOC-TEST-R01",
      "query": "Which module implements the GraphQL subscription transport?",
      "query_class": "direct_lookup",
      "strata": ["red_control", "negative", "conceptual"],
      "expected_answerable": false,
      "oracle_refs": ["crates/locus-core/src/evidence.rs:13"]
    }
  ]
}
